{
  "$schema": "https://json-schema.org/draft/2020-12/schema",
  "additionalProperties": false,
  "description": "Leader 内部任务，额外包含发现和依赖信息。",
  "properties": {
    "schemaVersion": {
      "const": "0.2",
      "title": "Schemaversion",
      "type": "string"
    },
    "subtaskId": {
      "minLength": 1,
      "pattern": "\\S",
      "title": "Subtaskid",
      "type": "string"
    },
    "taskType": {
      "enum": [
        "literature_search",
        "paper_read",
        "repository_analyze"
      ],
      "title": "Tasktype",
      "type": "string"
    },
    "goal": {
      "minLength": 1,
      "pattern": "\\S",
      "title": "Goal",
      "type": "string"
    },
    "input": {
      "additionalProperties": true,
      "title": "Input",
      "type": "object"
    },
    "constraints": {
      "additionalProperties": true,
      "title": "Constraints",
      "type": "object"
    },
    "outputSchema": {
      "minLength": 1,
      "pattern": "\\S",
      "title": "Outputschema",
      "type": "string"
    },
    "requiredSkill": {
      "minLength": 1,
      "pattern": "\\S",
      "title": "Requiredskill",
      "type": "string"
    },
    "dependsOn": {
      "items": {
        "minLength": 1,
        "pattern": "\\S",
        "type": "string"
      },
      "title": "Dependson",
      "type": "array"
    }
  },
  "required": [
    "schemaVersion",
    "subtaskId",
    "taskType",
    "goal",
    "input",
    "constraints",
    "outputSchema",
    "requiredSkill",
    "dependsOn"
  ],
  "title": "PlannerTask",
  "type": "object"
}
